{
  "输出类型": "模块提案",
  "关联语境": "ctx_example",
  "负责范围": {
    "模块": ["m_example"],
    "功能树节点": ["f_example"],
    "接口": [],
    "文件": []
  },
  "结论": "通过",
  "功能族展开": {
    "核心功能": [],
    "天然绑定功能": [],
    "商业标配功能": [],
    "待确认扩展": [],
    "跨模块提案": [],
    "明确排除": []
  },
  "变更提案": [],
  "接口影响": [],
  "风险": [],
  "必须同步": [],
  "验证责任": [],
  "证据": ["示例结构可解析"],
  "下一步": []
}

